{
  "schema_version": 1,
  "agent": {
    "id": "langgraph",
    "name": "LangGraph",
    "vendor": "LangChain",
    "kinds": [
      "framework"
    ],
    "platforms": [
      "python"
    ],
    "local_footprint": "yes",
    "rosmarops": {
      "status": "not_supported"
    },
    "reviewed_at": "2026-10-30"
  },
  "versions": [],
  "changes": [],
  "ratings": []
}
