{
  "schema_version": 1,
  "agent": {
    "id": "continue",
    "name": "Continue",
    "vendor": "Continue",
    "kinds": [
      "ide_extension"
    ],
    "platforms": [
      "windows",
      "macos",
      "linux"
    ],
    "local_footprint": "yes",
    "rosmarops": {
      "status": "detected",
      "since_version": "0.1.0"
    },
    "reviewed_at": "2026-10-28"
  },
  "versions": [],
  "changes": [],
  "ratings": []
}
